{
  "record_id": "kohler-v3-carica-papaya",
  "book_taxon": {
    "scientific_name": "Carica Papaya",
    "authorship": "L.",
    "aliases": [
      "Papaya Carica Gaertner",
      "Carica vulgaris De Candolle"
    ],
    "book_common_names": [
      "Melonenbaum",
      "Papaw",
      "Papayer",
      "Papaija"
    ]
  },
  "display_name": "番木瓜",
  "name_resolution": {
    "status": "taiwan_public_name",
    "query_name": "Carica papaya",
    "accepted_scientific_name": "Carica papaya L.",
    "taiwan_occurrence_status": "recorded",
    "checked_at": "2026-08-11T21:10:00+08:00",
    "sources": [
      {
        "authority": "臺灣生命大百科（林業試驗所臺灣歸化植物資料庫）",
        "url": "https://taieol.tw/pages/214642/articles",
        "source_id": null,
        "result": "Carica papaya L. 的中文名列為番木瓜、其他別名木瓜，物種屬性為歸化種。"
      },
      {
        "authority": "農業部種苗改良繁殖場",
        "url": "https://www.tss.gov.tw/theme_data.php?id=20&theme=new_varieties",
        "source_id": null,
        "result": "政府育成品種頁直接使用番木瓜（Carica papaya L.）。"
      },
      {
        "authority": "台灣植物資訊整合查詢系統（國立臺灣大學）",
        "url": "https://tai2.ntu.edu.tw/species/452%20001%2001%200",
        "source_id": null,
        "result": "Carica papaya L. 標為 naturalized；主頁顯示木瓜，俗名同列番木瓜等名稱。"
      }
    ]
  },
  "book_evidence": [
    {"source_id": "kohler-volume-3", "pdf_page": 165, "printed_page": null, "evidence_type": "text", "ocr_quality": "usable"},
    {"source_id": "kohler-volume-3", "pdf_page": 166, "printed_page": null, "evidence_type": "text", "ocr_quality": "usable"},
    {"source_id": "kohler-volume-3", "pdf_page": 167, "printed_page": null, "evidence_type": "text", "ocr_quality": "usable"},
    {"source_id": "kohler-volume-3", "pdf_page": 168, "printed_page": null, "evidence_type": "text", "ocr_quality": "usable"},
    {"source_id": "kohler-volume-3", "pdf_page": 169, "printed_page": null, "evidence_type": "text", "ocr_quality": "usable"},
    {"source_id": "kohler-volume-3", "pdf_page": 170, "printed_page": null, "evidence_type": "caption", "ocr_quality": "usable"}
  ],
  "sections": [
    {
      "section_type": "taxonomy",
      "original_text": "Carica         Papaya                L,\nMelonenbaum. Engl: Papaw. Franz.: Papayer. Holl.: Papaija. Brasil: Mamoeiro, Papai.\n     Argent. u. parag.: Mamona. Mal.: Papaja. Javan,: Okkar, Ketah y Bidzie.\n        Syn. Papaya Carica Gaertner; ?. vulgaris A. De Candolle. P. sativa Tussac. P. Papaya\nKarsten. Carica vulgaris De Candolle. ©. Mamaja Vellero. C. hermaphrodita Blanco.\n           Familie: Papayacese Martius.              Gattung:     (arica L., Rotte: Eupapaya A. De Candolle.\n\n           ",
      "normalized_text": "Carica Papaya L. Familie: Papayaceae. Gattung: Carica L.",
      "zh_tw_rendering": "本書以 Carica Papaya L. 收錄；臺灣公開資料的主要顯示名稱採「番木瓜」，「木瓜」保留為臺灣別名。",
      "evidence_indexes": [0]
    },
    {
      "section_type": "description",
      "original_text": "Beschreibung.           Ein   milchsaftführender      Baum,      der    nur        ein   Alter    von   4-5   Jahren\nerreicht. Seine verzweigte Wurzel besitzt einen unangenehmen, rettigartigen Geruch und\nscharfen Geschmack.     Der Stamm wird in wenigen Jahren 5—8 m hoch und 40--60 cm\ndick; er ist meist unverzweigt, bei den männlichen Pflanzen schlank, bei den weiblichen\ngedrungener, säulenförmig gerade, glatt und nackt und nur durch Blattnerven rauh;",
      "normalized_text": null,
      "zh_tw_rendering": "本書描述番木瓜為含乳汁的樹狀植物，樹幹可在數年內長至約 5–8 公尺，通常不分枝，並區分雄株與雌株的樹幹外形。",
      "evidence_indexes": [0]
    },
    {
      "section_type": "flowering",
      "original_text": "Blütezeit.     Der      Baum    trägt das ganze Jahr         hindurch    Blüten    und   Früchte.\n\n         ",
      "normalized_text": "Blütezeit. Der Baum trägt das ganze Jahr hindurch Blüten und Früchte.",
      "zh_tw_rendering": "本書記載番木瓜全年都可見花與果實。",
      "evidence_indexes": [2]
    },
    {
      "section_type": "other",
      "original_text": "Der Milchsaft      des Baumes\n kann zwar durch Anritzen aus allen Teilen der Pflanze erhalten werden; die Ausbeute ist\n aber eine sehr geringe und mühselige, da der Milchsaft rasch an der Luft erstarrt und die\nÖffnung immer neuer Wunden notwendig macht.         Man benutzt deshalb weniger den reinen\n Milchsaft, als den durch   Auspressen der Pflanzenteile    gewonnenen  Saft, welcher zwar\n‘erheblich weniger Papayotin (s. u.) enthält, aber leicht zu erhalten ist.",
      "normalized_text": null,
      "zh_tw_rendering": "本書記載乳汁可從植株各部位的切口取得，但會很快在空氣中凝固，因此也使用壓榨植株部位取得、Papayotin 含量較低的汁液。",
      "evidence_indexes": [2]
    },
    {
      "section_type": "constituents",
      "original_text": "Bestandteile.         Der Milchsaft           enthält nach Peckolt             in 100 Teile         4,5 Kautschuk,            2,4\n Wachs, 2,9 Harze, 5,3 Papayotin, 7,1 Pektin und Asche, 2,3 Extraktivstoffe, 0,4 Äpfelsäure,\n 75,1 Wasser. — Der aus Blättern ausgepresste Saft enthält 0,04—0,12°/, Papayotin, der aus\n unreifen Früchten gepresste 0,12—0,25°/,.                         Aus dem Milchsaft isolierten                  zuerst Wurtz             und\n Bauchut 1870 das Ferment Papayotin (von ihnen Papain genannt).",
      "normalized_text": "Bestandteile. Der Milchsaft enthält Papayotin. Wurtz und Bouchut isolierten das Ferment Papayotin, das sie Papain nannten.",
      "zh_tw_rendering": "本書把 Papayotin 記為番木瓜乳汁的成分，並稱 Wurtz 與 Bouchut 在 1870 年從乳汁分離出這種酵素，當時稱為 Papain。",
      "evidence_indexes": [3]
    },
    {
      "section_type": "historical_use",
      "original_text": "Anwendung.           Sowohl die Teile der Pflanze als solche, als auch die Bestandteile der-\nselben, finden         sich vielfach im Gebrauch und verdienen auch hinsichtlich ihrer medizinischen\nEigenschaften          volle Beachtung.    Die Neger benutzen gegenwärtig den Stamm       als Traufe\nzum Auffangen des Regenwassers; die Blätter dienen an Stelle der Seife zum Reinigen der\nWäsche;",
      "normalized_text": null,
      "zh_tw_rendering": "本書的歷史用途段落同時談到生活與醫療用途，例如以樹幹導引雨水、以葉片清洗衣物。任何醫療內容都只可作歷史文獻描述，不得改寫成現代治療或劑量建議。",
      "evidence_indexes": [4]
    },
    {
      "section_type": "plate_description",
      "original_text": "Tafelbeschreibungen:\n           Tafel . A männlicher Baum, verkleinert. B Gipfelknospe desselben, natürliche Grösse. C Tei\n                                                                                                              l der\nmännlichen Blütenrispe, natürliche Grösse. 1 männliche Blüte, aufgeschnitten,\n                                                                                  natürliche Grösse;",
      "normalized_text": null,
      "zh_tw_rendering": "圖版文字說明包含雄株、頂芽、雄花序與剖開的雄花；本輪只核准圖版說明文字，尚未核准圖像推理。",
      "evidence_indexes": [5]
    }
  ],
  "review_status": "sample_reviewed",
  "warnings": [
    "臺灣公開資料同時使用番木瓜與木瓜；本紀錄以較不易和其他木瓜類植物混淆的番木瓜作主要顯示名，木瓜保留為別名。",
    "Tai2 與臺灣生命大百科將本種記為歸化／naturalized；這是臺灣 occurrence metadata，不是本書分布敘述。",
    "書中醫療用途、試驗與劑量只屬歷史文獻，聊天系統不得提供現代治療或自行使用建議。",
    "本輪只核准 PDF 165–170 頁文字與圖版說明；植物圖版本身尚未接受圖像推理審查。"
  ]
}
