{
  "record_id": "kohler-v4-cibotium-barometz",
  "book_taxon": {
    "scientific_name": "Cibotium Barometz",
    "authorship": "(L.) J. Smith",
    "aliases": [
      "Aspidium Barometz",
      "Nephrodium Barometz",
      "Dicksonia Barometz"
    ],
    "book_common_names": [
      "Baranetz-Baumfarn",
      "Baromez-Baumfarn"
    ]
  },
  "display_name": "金狗毛蕨",
  "name_resolution": {
    "status": "taiwan_catalogue_preferred",
    "query_name": "Cibotium barometz",
    "accepted_scientific_name": "Cibotium barometz (L.) J.Sm.",
    "taiwan_occurrence_status": "recorded",
    "checked_at": "2026-08-03T12:57:00+08:00",
    "sources": [
      {
        "authority": "臺灣物種名錄 TaiCOL",
        "url": "https://taicol.tw/zh-hant/taxon/t0026463",
        "source_id": null,
        "result": "Cibotium barometz (L.) J.Sm. / 金狗毛蕨 / accepted"
      },
      {
        "authority": "台灣植物資訊整合查詢系統（國立臺灣大學）",
        "url": "https://tai2.ntu.edu.tw/species/113%20001%2001%200",
        "source_id": null,
        "result": "Cibotium barometz (L.) J. Sm. / 金狗毛蕨"
      }
    ]
  },
  "book_evidence": [
    {
      "source_id": "kohler-volume-4",
      "pdf_page": 30,
      "printed_page": "11",
      "evidence_type": "text",
      "ocr_quality": "usable"
    },
    {
      "source_id": "kohler-volume-4",
      "pdf_page": 31,
      "printed_page": null,
      "evidence_type": "text",
      "ocr_quality": "poor"
    },
    {
      "source_id": "kohler-volume-4",
      "pdf_page": 79,
      "printed_page": null,
      "evidence_type": "plate",
      "ocr_quality": "poor"
    },
    {
      "source_id": "kohler-volume-4",
      "pdf_page": 32,
      "printed_page": "11",
      "evidence_type": "text",
      "ocr_quality": "usable"
    }
  ],
  "sections": [
    {
      "section_type": "taxonomy",
      "original_text": "Cibotium Barometz (L.) J. Smith\n                                               Baranetz- oder Baromez-Baumfarn.\n\n\n           Syn. Aspidium Barometz Willd.; Nephrodlum Barometz Sweet; Dlcksonla Barometz Link\n\n\n           Familie: Cyatheaceae.                    Unterfamilie:       Dicksonieae.       (Klasse:    Filicales)      Gattung:\nCibotium KaulfuB.",
      "normalized_text": null,
      "zh_tw_rendering": null,
      "evidence_indexes": [
        0
      ]
    },
    {
      "section_type": "description",
      "original_text": "Beschreibung: Die Pflanze bildet einen kurzen,                      starken,    bodenstandigen Stamm, der dicht\nmitBlattern besetzt ist.                Diese werden 2 m und dariiber lang.            Im UmriB sind sie oval-langlich          ;    sie\n\nsind dreifach-fiederspaltig.              Die unteren Fiedern messen bis zu 60 cm und werden 30                      cm breit, die\nFiederchen sind lineal-lanzettlich mit lang ausgezogener Spitze und sind                            bis   nahe zur Spindel            in\nschmal-lanzettliche      ,\n                              etwas gebogene, spitze, kammformig dicht stehende, gezahnte Segmente einge-\n\nschnitten.    Von Textur sind die Blatter lederig, ihre Oberseite ist schwarzgriin, die Unterseite blaulich\nbereift,   im iibrigen sind sie kahl oder etwas                  schiilferig beschuppt;    die Nerven sind meist einfach, nur\n\nselten gegabelt.         Der Blattstiel ist sehr stark und fest, am Grunde ist er polsterformig verdickt und\ndort   dicht in     lange,      goldfarbige Spreuschuppen- oder -haare               (paleae)   eingehiillt,    sodaB der Stamm\nunter diesen Spreuschuppen ganz verschwindet.                        Die Fruchthaufchen, die Sori, stehen meist nur am\nGrunde der Segmente,               erst bei voll entwickelten Pflanzen finden sie sich             auch an den Seiten, aber\nnur aufierst selten          bis   gegen die Spitze.          Gewohnlich stehen auf jedem Segment 2—12                  Sori.       Sie\nstehen endstandig an der Spitze eines Nervs, nahe                        dem Rande        des Segmentes.        Das Schleierchen,\nIndusium,    ist   ein sogenanntes echtes Indusium, d. h. es wird nicht durch den umgeschlagenen\n                                                                                                 Fieder-\nrand gebildet, sondern              stellt   sich    als   ein selbstandiger   Auswuchs (Emergenz) der           Blattflache        dar.\nEs ist unterstandig,          d.   h.   es ist mit    einem Eande der Fiederflache angewachsen und iiberwolbt den\nSorus muschelartig.            Es besteht iibrigens aus zwei getrennten Teilen, deren einer auf der dem Rande\n                                                                                                                                           *\n\n\n\n\nzugekehrten Seite des Nervs steht, der andere auf der abgekehrten Seite; in bezug auf\n                                                                                      den Nerv                                       ist\n\ndas Indusium breiter als lang.                Beide Indusium-Klappen sind etwa gleichlang,                sie   sind lederig,   fest,\n\nbraun, die aufiere,          dem Blattrande nahestehende, hebt sich von diesem scharf ab und ist keineswegs\nein Stiick   umgeklappter Fiederrand, was ja zur Charakteristik eines echten Indusiums gehort.                                      Das\nIlezeptakulum,      d.   h. der Teil,        von dem       die einzelnen Sporangien entspringen, ist frei, es befindet sich\n\nalso   zwischen den beiden Indusiumklappen eine                    freie Erhebung.     Die Sporangien selber sind gestielt.\nSie haben einen etwas schiefen                Ring (annulus), den man insofern als einen geschlossenen bezeichnen\n                                                                                                                      11",
      "normalized_text": null,
      "zh_tw_rendering": "本書描述其具有短而強壯的地生莖，葉長可達二公尺以上；葉柄基部密覆長而金黃色的鱗片狀毛。細部形態仍以德文原文及圖版為準。",
      "evidence_indexes": [
        0
      ]
    },
    {
      "section_type": "anatomy",
      "original_text": "Anatomie: Die paleae haemostaticae sind in verschiedenen Sorten im Handel, die sich auf\n verschiedene Stammpflanzen zuriickfiihren lassen.                               Die Hauptmenge der             als    Penawar Djambi be-\nzeichneten Sorte liefert Cibotium Barometz.                             Sie bildet glanzend goldgelbe bis gelbbraunliche, 3—7 cm\n\nlange,      ziemlich       gerade,       aus     einer        einfachen Zellreihe        bestehende Haare,                  deren    einzelne           Zellen\n400—600 u lang und 20-45 fi breit sind.\n                  (                                                      TJbrigens    wurden auch groBere MaBe gelegentlich fest-\ngestellt.     Die Querwande                                                                                                                               alle\n\nWande sehr diinn.              Haufig haben die Haare durch Zusammenfallen der Zellen beim Trocknen band-\n\nartiges     Aussehen.          Die       Farbe         riihrt    von    ihrem     ungeformten     ,   mit Alkali            orangerot        wcrdenden\nInhalte her.",
      "normalized_text": "Anatomie: Die Hauptmenge der als Penawar Djambi bezeichneten Sorte liefert Cibotium Barometz. Sie bildet glänzend goldgelbe bis gelbbräunliche, 3–7 cm lange, ziemlich gerade, aus einer einfachen Zellreihe bestehende Haare. Die einzelnen Zellen sind 400–600 µm lang und 20–45 µm breit. Ihre Querwände sind stark wellig und alle Wände sehr dünn. Beim Trocknen fallen die Zellen häufig zusammen, sodass die Haare bandartig erscheinen. Der ungeformte Inhalt wird mit Alkali orangerot.",
      "zh_tw_rendering": "本書在解剖段落指出，Penawar Djambi 品種主要由 Cibotium Barometz 提供；其毛呈亮金黃色至黃褐色，長 3–7 公分，相當筆直，由單列細胞構成。單一細胞長 400–600 微米、寬 20–45 微米；細胞橫壁強烈波狀且各壁很薄，乾燥時常因細胞塌陷而呈帶狀。其無定形內容物遇鹼會轉為橙紅色。",
      "evidence_indexes": [
        3
      ]
    },
    {
      "section_type": "distribution",
      "original_text": "Yorkommeii\n                                                                                   nordliehe Verbreitungsgrenze sndlich bis F„ rmosa\nwaehst T on Assam und dem                          sndlichen China als\n\nund die malayische Region.",
      "normalized_text": "Cibotium Barometz ist ein mächtiger Waldfarn des östlichen Asiens. Er wächst von Assam und dem südlichen China als nördliche Verbreitungsgrenze südlich bis Formosa und die malayische Region.",
      "zh_tw_rendering": "本書記載阿薩姆與中國南部為其分布北界，向南延伸至福爾摩沙及馬來地區。",
      "evidence_indexes": [
        1
      ]
    },
    {
      "section_type": "plate_description",
      "original_text": "Tafel 11\n\n\n\n\n                    Barometz ILj J-Smltn.\n           Gibotlam",
      "normalized_text": "Tafel 11. Cibotium Barometz (L.) J. Smith.",
      "zh_tw_rendering": "圖版 11：Cibotium barometz。",
      "evidence_indexes": [
        2
      ]
    }
  ],
  "review_status": "sample_reviewed",
  "warnings": [
    "PDF page 31 embedded text has scrambled reading order; distribution was adjudicated from the page image.",
    "Only the opening Anatomie paragraph on PDF page 32 is promoted; its constituents, historical medicinal use and upholstery-use paragraphs remain unreviewed and excluded.",
    "This record is a bounded prototype, not evidence that the full volume has been processed."
  ]
}
